{
  "schema_version": "0.1-experimental",
  "status": "candidate_probe",
  "provenance": {
    "purpose": "Probe whether six concepts can be decomposed into explicit grounded factors and projected into DOLCE, BFO, and UFO without asserting premature equivalence.",
    "authority": "Experimental evaluation artifact only; it does not modify linguistic_core@0.3.3 or the living design.",
    "literature_status": "Top-level ontology projection targets were spot-checked against official or maintainer documentation on 2026-10-01. PMG-to-factor derivations and semantic-basis classifications remain hypotheses requiring review."
  },
  "factors": [
    {
      "id": "gf:phenomenal_similarity_space",
      "label": "phenomenal similarity space",
      "kind": "quality_space",
      "basis": [
        "phenomenal",
        "psychophysical"
      ],
      "dependencies": [],
      "evidence": [
        {
          "kind": "phenomenal",
          "status": "candidate",
          "note": "PMG posits intrinsic similarity/difference structure among phenomenal states."
        },
        {
          "kind": "psychophysical",
          "status": "candidate",
          "note": "Psychophysical discrimination and similarity judgments may constrain this structure; exact recoverability is unresolved."
        }
      ]
    },
    {
      "id": "gf:quality_region",
      "label": "quality-space region",
      "kind": "region",
      "basis": [
        "phenomenal",
        "learned"
      ],
      "dependencies": [
        "gf:phenomenal_similarity_space"
      ],
      "evidence": [
        {
          "kind": "learned",
          "status": "candidate",
          "note": "A category such as red can be represented as a learned/stabilized region rather than an atomic symbol."
        }
      ]
    },
    {
      "id": "gf:persistent_object_pattern",
      "label": "persistent object pattern",
      "kind": "persistent_pattern",
      "basis": [
        "sensorimotor",
        "learned"
      ],
      "dependencies": [],
      "evidence": [
        {
          "kind": "sensorimotor",
          "status": "candidate",
          "note": "PMG proposes proto-object formation from temporal persistence, spatial continuity, feature co-occurrence, predictable transformation, and cross-modal agreement."
        }
      ]
    },
    {
      "id": "gf:temporal_occurrence_pattern",
      "label": "temporally extended occurrence",
      "kind": "transition_pattern",
      "basis": [
        "phenomenal",
        "learned"
      ],
      "dependencies": [],
      "evidence": [
        {
          "kind": "phenomenal",
          "status": "candidate",
          "note": "Temporal succession is primitive in PMG; event identity is not yet derived."
        }
      ]
    },
    {
      "id": "gf:participant_in_occurrence",
      "label": "participant in occurrence",
      "kind": "participation_pattern",
      "basis": [
        "learned",
        "formal"
      ],
      "dependencies": [
        "gf:persistent_object_pattern",
        "gf:temporal_occurrence_pattern"
      ],
      "evidence": [
        {
          "kind": "learned",
          "status": "candidate",
          "note": "Stable bearers can be tracked across temporally structured changes; the exact derivation of participation remains to be formalized."
        }
      ]
    },
    {
      "id": "gf:support_relation",
      "label": "support relation",
      "kind": "relational_pattern",
      "basis": [
        "sensorimotor",
        "learned"
      ],
      "dependencies": [
        "gf:persistent_object_pattern"
      ],
      "evidence": [
        {
          "kind": "sensorimotor",
          "status": "candidate",
          "note": "Contact, relative geometry, load/pressure, and resistance to downward displacement are candidate lower-level cues."
        }
      ]
    },
    {
      "id": "gf:support_disposition",
      "label": "support disposition",
      "kind": "disposition_pattern",
      "basis": [
        "learned",
        "formal"
      ],
      "dependencies": [
        "gf:support_relation"
      ],
      "evidence": [
        {
          "kind": "learned",
          "status": "candidate",
          "note": "Generalizes from actual support episodes to counterfactual capacity under suitable conditions."
        }
      ]
    },
    {
      "id": "gf:sitting_body_configuration",
      "label": "sitting body configuration",
      "kind": "persistent_pattern",
      "basis": [
        "sensorimotor",
        "learned"
      ],
      "dependencies": [
        "gf:persistent_object_pattern"
      ],
      "evidence": [
        {
          "kind": "sensorimotor",
          "status": "candidate",
          "note": "Characteristic torso/hip/leg configuration and pressure/contact pattern; precise invariants are unresolved."
        }
      ]
    },
    {
      "id": "gf:sitting_event_pattern",
      "label": "sitting event pattern",
      "kind": "transition_pattern",
      "basis": [
        "sensorimotor",
        "learned"
      ],
      "dependencies": [
        "gf:sitting_body_configuration",
        "gf:support_relation",
        "gf:temporal_occurrence_pattern"
      ],
      "evidence": [
        {
          "kind": "learned",
          "status": "candidate",
          "note": "Integrates bodily configuration, support relation, and temporal transition into an action/event category."
        }
      ]
    },
    {
      "id": "gf:artifact_status",
      "label": "artifact status",
      "kind": "symbolic_construction",
      "basis": [
        "social",
        "learned"
      ],
      "dependencies": [
        "gf:persistent_object_pattern"
      ],
      "evidence": [
        {
          "kind": "social",
          "status": "candidate",
          "note": "Requires socially/historically stabilized interpretation of an object as intentionally made or selected for functions."
        }
      ]
    },
    {
      "id": "gf:conventional_seating_function",
      "label": "conventional seating function",
      "kind": "role_pattern",
      "basis": [
        "social",
        "learned"
      ],
      "dependencies": [
        "gf:support_disposition",
        "gf:sitting_event_pattern",
        "gf:artifact_status"
      ],
      "evidence": [
        {
          "kind": "social",
          "status": "candidate",
          "note": "Captures conventional/intended use for sitting rather than mere accidental sit-ability."
        }
      ]
    }
  ],
  "concepts": [
    {
      "id": "gc:red",
      "label": "red",
      "target_level": "phenomenal_category",
      "factorization": [
        "gf:phenomenal_similarity_space",
        "gf:quality_region"
      ],
      "grounding_status": "partially_grounded",
      "semantic_basis": {
        "nsm": "molecule_or_complex",
        "longman": "not_checked",
        "note": "Do not treat the English word as the grounding primitive; the probe treats red as a stabilized region in a quality space. NSM/Longman status needs direct lexical-source checking."
      },
      "ontology_projections": [
        {
          "ontology": "DOLCE",
          "target": "Quality + quality region/quale",
          "relation": "partial_projection",
          "preserved": [
            "particular quality/value distinction",
            "quality-space location"
          ],
          "lost_or_added": [
            "DOLCE adds bearer/dependence commitments not yet derived by PMG"
          ],
          "status": "source_checked",
          "source": "https://www.loa.istc.cnr.it/old/Papers/DOLCE-EKAW.pdf"
        },
        {
          "ontology": "BFO",
          "target": "quality",
          "relation": "partial_projection",
          "preserved": [
            "dependent quality bearer structure"
          ],
          "lost_or_added": [
            "BFO core does not supply the same generalized quality-space geometry"
          ],
          "status": "source_checked",
          "source": "https://github.com/BFO-ontology/BFO-2020"
        },
        {
          "ontology": "UFO",
          "target": "Quality + QualityValue",
          "relation": "partial_projection",
          "preserved": [
            "reified quality",
            "quality value, including multidimensional values"
          ],
          "lost_or_added": [
            "UFO value structure does not by itself ground phenomenal similarity"
          ],
          "status": "source_checked",
          "source": "https://nemo-ufes.github.io/gufo/overview.html"
        }
      ],
      "open_gaps": [
        "Define empirical relation between psychophysical measurements and the proposed phenomenal metric.",
        "Separate a particular red-quality token from a learned red category and lexical sense."
      ]
    },
    {
      "id": "gc:object",
      "label": "object",
      "target_level": "ontological_category",
      "factorization": [
        "gf:persistent_object_pattern"
      ],
      "grounding_status": "partially_grounded",
      "semantic_basis": {
        "nsm": "not_checked",
        "longman": "not_checked",
        "note": "This probe is about earned persistence/identity structure, not the lexical item 'object'."
      },
      "ontology_projections": [
        {
          "ontology": "DOLCE",
          "target": "Endurant / Physical Object candidate",
          "relation": "licenses_classification_as",
          "preserved": [
            "persistence across change",
            "bearer-like identity"
          ],
          "lost_or_added": [
            "DOLCE ontological commitments exceed the current developmental derivation"
          ],
          "status": "source_checked",
          "source": "https://www.loa.istc.cnr.it/dolce/overview.html"
        },
        {
          "ontology": "BFO",
          "target": "independent continuant / object candidate",
          "relation": "licenses_classification_as",
          "preserved": [